PMID	Year	Title
39609032	2024	Using normalisation process theory to evaluate the implementation of a digital health intervention in community and secondary care long COVID clinics.
39610330	2024	Association Between NK Cell Genetic Variants and the Development of Long COVID Associated- and Prepandemic Small Fiber Neuropathy.
39611127	2024	Effect of oral zinc and steroids on long COVID hyposmia and hypogeusia.
39611465	2024	Association of Workplace Stressors Prior to infection and the development of long-COVID among workers during the COVID-19 pandemic: a cohort study in Japan.
39611942	2024	Maximal oxygen uptake, pulmonary function and walking economy are not impaired in patients diagnosed with long COVID.
